ItemNumber	Description	Manufacturer	Category	ImageURL	PDFURL	ProductURL	Tags
70156759	Door Interlock Handle	ALTECH CORP	Electrical	https://ryedesign.github.io/spare-parts-assets/Altech_70156759_DoorInterlockHandle.png	https://ryedesign.github.io/spare-parts-assets/Altech_70156759_DoorInterlockHandle.pdf		altech corp, door lock, electrical, interlock, safety interlock, safety switch
70156984	Switch and Accessory, 25 A, 600 VAC (Max.), 3, 50.5 mm, 74 mm, 73 mm, 16	ALTECH CORP	Electrical	https://ryedesign.github.io/spare-parts-assets/Altech_70156984_SwitchAccessory.png	https://ryedesign.github.io/spare-parts-assets/Altech_70156984_SwitchAccessory.pdf		altech corp, electrical
70156626	Accessory, 300 mm, Pistol handle	ALTECH CORP	Electrical	https://ryedesign.github.io/spare-parts-assets/Altech_70156626_300mmPistolHandle.png	https://ryedesign.github.io/spare-parts-assets/Altech_70156626_300mmPistolHandle.pdf		altech corp, electrical
GM000020.00	FLEXIBOWL, CLOCKWISE, QUICK EMPTYING	ARS	Robotics Accessories	https://ryedesign.github.io/spare-parts-assets/ARS_GM000020.00_Flexibowl.png	https://ryedesign.github.io/spare-parts-assets/ARS_GM000020.00_Flexibowl.pdf		ars, robotics accessories
8652APBK4QA00GA	652 Series Filter-Regulator Particulate	AVENTICS	Pneumatics	https://ryedesign.github.io/spare-parts-assets/Aventics_8652APBK4QA00GA_652SeriesFilter.png	https://ryedesign.github.io/spare-parts-assets/Aventics_8652APBK4QA00GA_652SeriesFilter.pdf		aventics, emerson pneumatics, filter regulator, frl, numatics, pneumatics, pressure regulator, regulator
8653APBK4R101GA	653 Series Filter-Regulator Particulate	AVENTICS	Pneumatics	https://ryedesign.github.io/spare-parts-assets/Aventics_8653APBK4R101GA_653SeriesFilter.png	https://ryedesign.github.io/spare-parts-assets/Aventics_8653APBK4R101GA_653SeriesFilter.pdf		aventics, emerson pneumatics, filter regulator, frl, numatics, pneumatics, pressure regulator, regulator
CCI-DA-050-0100	CYLINDER, 50MM BORE X 100 MM S TROKE, COMPACT	AVENTICS	Pneumatics	https://ryedesign.github.io/spare-parts-assets/Aventics_CCI-DA-050-0100_Cylinder.png	https://ryedesign.github.io/spare-parts-assets/Aventics_CCI-DA-050-0100_Cylinder.pdf		actuator, air cylinder, aventics, cylinder, emerson pneumatics, numatics, pneumatic cylinder, pneumatics
K502AK431477003	502 EP VERT 1/2PF STD KT	AVENTICS	Pneumatics	https://ryedesign.github.io/spare-parts-assets/Aventics_K502AK431477003_502EPVERT12PFSTDKT.png	https://ryedesign.github.io/spare-parts-assets/Aventics_K502AK431477003_502EPVERT12PFSTDKT.pdf		aventics, emerson pneumatics, numatics, pneumatics
K502AMM22MA0010	502 Series Manifold Sub Base	AVENTICS	Pneumatics	https://ryedesign.github.io/spare-parts-assets/Aventics_K502AMM22MA0010_502SeriesManifolSubBase.png	https://ryedesign.github.io/spare-parts-assets/Aventics_K502AMM22MA0010_502SeriesManifolSubBase.pdf		aventics, emerson pneumatics, manifold, numatics, pneumatic manifold, pneumatics, valve manifold
K503AK428327005	503 EP VERT 1/2PF STD KT	AVENTICS	Pneumatics	https://ryedesign.github.io/spare-parts-assets/Aventics_K503AK428327005_503EPVERT12PFSTDKT.png	https://ryedesign.github.io/spare-parts-assets/Aventics_K503AK428327005_503EPVERT12PFSTDKT.pdf		aventics, emerson pneumatics, numatics, pneumatics
K503AMM22MA0010	503 PRO MANF 1/4PF DBL KT (Manifold Sub Base)	AVENTICS	Pneumatics	https://ryedesign.github.io/spare-parts-assets/Aventics_K503AMM22MA0010_ ManifoldBlock.png	https://ryedesign.github.io/spare-parts-assets/Aventics_K503AMM22MA0010_ 503PROMANF14PFDBLKT.pdf		aventics, emerson pneumatics, manifold, numatics, pneumatic manifold, pneumatics, valve manifold
K503AMM23MA0010	503 PRO MANF 3/8PF DBL KT (Manifold Sub Base)	AVENTICS	Pneumatics	https://ryedesign.github.io/spare-parts-assets/Aventics_K503AMM23MA0010_503PROMANF14PFDBLKT.png	https://ryedesign.github.io/spare-parts-assets/Aventics_K503AMM23MA0010_503PROMANF14PFDBLKT.pdf		aventics, emerson pneumatics, manifold, numatics, pneumatic manifold, pneumatics, valve manifold
L12BB452B000061	SOLENOID VALVE, 5/2 DOUBLE ACTING	AVENTICS	Pneumatics	https://ryedesign.github.io/spare-parts-assets/Aventics_L12BB452B000061_SOLENOIDVALVE.png	https://ryedesign.github.io/spare-parts-assets/Aventics_L12BB452B000061_ SOLENOIDVALVE.pdf		aventics, directional control, emerson pneumatics, numatics, pneumatic valve, pneumatics, solenoid, valve
M503AG521734009	PNEUMATIC PRESSURE GAUGE	AVENTICS	Pneumatics	https://ryedesign.github.io/spare-parts-assets/Aventics_M503AG521734009_PNEUMATICPRESSUREGAUGE.png	https://ryedesign.github.io/spare-parts-assets/Aventics_M503AG521734009_PNEUMATICPRESSUREGAUGE.pdf		aventics, emerson pneumatics, numatics, pneumatics
P503AB428359001	P503AB428359001 BLANK PLATE 503 SERIES	AVENTICS	Pneumatics	https://ryedesign.github.io/spare-parts-assets/Aventics_P503AB428359001_BlankingPlate.png	https://ryedesign.github.io/spare-parts-assets/Aventics_P503AB428359001_BlankingPlate.pdf		aventics, emerson pneumatics, numatics, pneumatics
P580AEED1010A00	580 ETHERNT/IP DLR MOD STD KIT	AVENTICS	Electrical	https://ryedesign.github.io/spare-parts-assets/Aventics_P580AEED1010A00_EthernetIPKit.png	https://ryedesign.github.io/spare-parts-assets/Aventics_P580AEED1010A00_EthernetIPKit.pdf		aventics, electrical, emerson pneumatics, numatics
P599AE428444001	599 TERM STRP MOD STD KT	AVENTICS	Electrical	https://ryedesign.github.io/spare-parts-assets/Aventics_P599AE428444001_TerminalStripKit.png	https://ryedesign.github.io/spare-parts-assets/Aventics_P599AE428444001_TerminalStripKit.pdf		aventics, electrical, emerson pneumatics, numatics
P652AT503860002	651 SIDE MNT BRKT KIT	AVENTICS	Hardware	https://ryedesign.github.io/spare-parts-assets/Aventics_P652AT503860002_SideMountBrackets.png	https://ryedesign.github.io/spare-parts-assets/Aventics_P652AT503860002_SideMountBrackets.pdf		aventics, emerson pneumatics, hardware, numatics
R422001237	CYLINDER, 50mm BORE X 100mm STROKE, COMPACT	AVENTICS	Pneumatics	https://ryedesign.github.io/spare-parts-assets/Aventics_R422001237_CYLINDER50MMBORE100MMSTROKE.png	https://ryedesign.github.io/spare-parts-assets/Aventics_R422001237_CYLINDER50MMBORE100MMSTROKE.pdf		actuator, air cylinder, aventics, cylinder, emerson pneumatics, numatics, pneumatic cylinder, pneumatics
R502A1B50MA00F1	502 Series Valve	AVENTICS	Pneumatics	https://ryedesign.github.io/spare-parts-assets/Aventics_R502A1B50MA00F1_502SeriesValve.png	https://ryedesign.github.io/spare-parts-assets/Aventics_R502A1B50MA00F1_502SeriesValve.pdf		aventics, directional control, emerson pneumatics, numatics, pneumatic valve, pneumatics, solenoid, valve
R502AS429395002	502 PRO SAND SPD CNTRL KT	AVENTICS	Pneumatics	https://ryedesign.github.io/spare-parts-assets/Aventics_R502AS429395002_502SeriesThrottleSandwichPlate.png	https://ryedesign.github.io/spare-parts-assets/Aventics_R502AS429395002_502SeriesThrottleSandwichPlate.pdf		aventics, emerson pneumatics, numatics, pneumatics
R503A1B10MA00F1	503 F1 S/S PLGN A00F1 VALVE	AVENTICS	Pneumatics	https://ryedesign.github.io/spare-parts-assets/Aventics_R503A1B10MA00F1_503SeriesDirectionalValve.png	https://ryedesign.github.io/spare-parts-assets/Aventics_R503A1B10MA00F1_503SeriesDirectionalValve.pdf		aventics, directional control, emerson pneumatics, numatics, pneumatic valve, pneumatics, solenoid, valve
R503A1B50MA00F1	SOLENOID VALVE 5/3 WAY DUAL SOLENOID 24 V DC 503 SERIES	AVENTICS	Pneumatics	https://ryedesign.github.io/spare-parts-assets/Aventics_R503A1B50MA00F1_503SeriesDirectionalValve.png	https://ryedesign.github.io/spare-parts-assets/Aventics_R503A1B50MA00F1_503SeriesDirectionalValve.pdf		aventics, directional control, emerson pneumatics, numatics, pneumatic valve, pneumatics, solenoid, valve
R503A2B60MA00F1	503 Series Valve Actuation: Rubber Packed Valve Type: Solenoid Pilot with Flush Non-Locking Override	AVENTICS	Pneumatics	https://ryedesign.github.io/spare-parts-assets/Aventics_R503A2B60MA00F1_503SeriesDirectionalValve.png	https://ryedesign.github.io/spare-parts-assets/Aventics_R503A2B60MA00F1_503SeriesDirectionalValve.pdf		aventics, directional control, emerson pneumatics, numatics, pneumatic valve, pneumatics, solenoid, valve
R503ARS11JA0010	503 PRO RS 130PSIG KT (Regulator)	AVENTICS	Pneumatics	https://ryedesign.github.io/spare-parts-assets/Aventics_R503ARS11JA0010_502SeriesManifoldSubBase.png	https://ryedesign.github.io/spare-parts-assets/Aventics_R503ARS11JA0010_502SeriesManifoldSubBase.pdf		aventics, emerson pneumatics, filter regulator, frl, numatics, pneumatics, pressure regulator, regulator
19248	TL50BLGYRALSQ TOWER LIGHT W/ ADJUSTABLE ALARM	BANNER	Safety	https://ryedesign.github.io/spare-parts-assets/Banner_19248_TL50BLGYRALSQTowerLight.png	https://ryedesign.github.io/spare-parts-assets/Banner_19248_TL50BLGYRALSQTowerLight.pdf		banner, banner engineering, indicator, safety, signal light, stack light, tower light
25298	SSA-EB1P-02ECQ4 ESTOP	BANNER	Safety	https://ryedesign.github.io/spare-parts-assets/Banner_25298_SSA-EB1P-02ECQ4Estop.png	https://ryedesign.github.io/spare-parts-assets/Banner_25298_SSA-EB1P-02ECQ4Estop.pdf		banner, banner engineering, e-stop, emergency stop, estop, safety, safety stop
32037	K50LGRXPPB2Q PUSH BUTTON	BANNER	Safety	https://ryedesign.github.io/spare-parts-assets/Banner_32037_K50LGRXPPB2QPushButton.png	https://ryedesign.github.io/spare-parts-assets/Banner_32037_K50LGRXPPB2QPushButton.pdf		banner, banner engineering, momentary switch, operator, push button, pushbutton, safety
32723	SMB30A ESTOP BRACKET	BANNER	Hardware	https://ryedesign.github.io/spare-parts-assets/Banner_32723_SMB30ABracket.png	https://ryedesign.github.io/spare-parts-assets/Banner_32723_SMB30ABracket.pdf		banner, banner engineering, bracket, e-stop, emergency stop, estop, hardware, mounting, safety stop
81861	TL50GYRQ STACK LIGHT	BANNER	Safety	https://ryedesign.github.io/spare-parts-assets/Banner_81831_TL50GYRQTowerLight.png	https://ryedesign.github.io/spare-parts-assets/Banner_81831_TL50GYRQTowerLight.pdf		banner, banner engineering, indicator, safety, signal light, stack light, tower light
82232	LEDILA435XD6-PHQ VISION LIGHT, IR, BAR, 490mm, DIMMABLE	BANNER	Safety	https://ryedesign.github.io/spare-parts-assets/Banner_82232_LEDILA435XD6-PHQLinearArrayLight.png	https://ryedesign.github.io/spare-parts-assets/Banner_82232_LEDILA435XD6-PHQLinearArrayLight.pdf		banner, banner engineering, illumination, led light, light, safety, vision light
85064	XS26-2DE SAFETY PLC, CONTROLLER	BANNER	Safety	https://ryedesign.github.io/spare-parts-assets/Banner_85064_XS26-2DESafetyController.png	https://ryedesign.github.io/spare-parts-assets/Banner_85064_XS26-2DESafetyController.pdf		banner, banner engineering, controller, plc, safety, safety controller, safety plc
85075	XS2RO SAFETY PLC, RELAYS	BANNER	Safety	https://ryedesign.github.io/spare-parts-assets/Banner_85075_XS2ROSafetyRelay.png	https://ryedesign.github.io/spare-parts-assets/Banner_85075_XS2ROSafetyRelay.pdf		banner, banner engineering, controller, output relay, plc, relay, safety, safety controller, safety plc, switching
96930	K70APT2GRYF2Q LIGHTUP BUTTON	BANNER	Safety	https://ryedesign.github.io/spare-parts-assets/Banner_96930_K70APT2GRYF2QTouchButton.png	https://ryedesign.github.io/spare-parts-assets/Banner_96930_K70APT2GRYF2QTouchButton.pdf		banner, banner engineering, safety
806960	WLS15XGR0500DSC2 STRIP LIGHT	BANNER	Safety	https://ryedesign.github.io/spare-parts-assets/Banner_806960_WLS15XGR0500DSC2StripLight.png	https://ryedesign.github.io/spare-parts-assets/Banner_806960_WLS15XGR0500DSC2StripLight.pdf		banner, banner engineering, illumination, led light, light, safety, vision light
813105	ZMX TIME-OF-FLIGHT VOLUME SENSOR	BANNER	Sensors	https://ryedesign.github.io/spare-parts-assets/Banner_813105_ZMX-3DE2500HF-Q7TimeofFlightSensor.png	https://ryedesign.github.io/spare-parts-assets/Banner_813105_ZMX-3DE2500HF-Q7TimeofFlightSensor.pdf		banner, banner engineering, distance sensor, sensors, time of flight, tof, volume sensor
25550	SSA-MBK-EEC1 rt angle racket for e-stop	BANNER	Safety	https://ryedesign.github.io/spare-parts-assets/Banner_25550_SSA-MBK-EEC1RtAngleEstopBracket.jpg	https://ryedesign.github.io/spare-parts-assets/Banner_25550_SSA-MBK-EEC1RtAngleEstopBracket.pdf		banner, banner engineering, e-stop, emergency stop, estop, safety, safety stop
69701	SSA-EBM-12L PANEL MOUNT E-STOP BUTTONS	BANNER	Safety	https://ryedesign.github.io/spare-parts-assets/Banner_69701_SSA-EBM-12LEstop.png	https://ryedesign.github.io/spare-parts-assets/Banner_69701_SSA-EBM-12LEstop.pdf		banner, banner engineering, bracket, cabinet, e-stop, electrical enclosure, emergency stop, enclosure, estop, hardware, mounting, panel, safety, safety stop
809837	S15C-I-KQ : In-Line Converter. Voltage: 18-30 V dc IP67	BANNER	Power	https://ryedesign.github.io/spare-parts-assets/Banner_809837_S15C-I-KQInLineConverter.png	https://ryedesign.github.io/spare-parts-assets/Banner_809837_S15C-I-KQInLineConverter.pdf		banner, banner engineering, power
813874	DXMR90-4K IO Link Master/Controller	BANNER	Electrical	https://ryedesign.github.io/spare-parts-assets/Banner_813874_DXMR90-4KLinkMaster.png	https://ryedesign.github.io/spare-parts-assets/Banner_813874_DXMR90-4KLinkMaster.pdf		banner, banner engineering, electrical
85069	XS16SI Digital/Safety Input Extension	BANNER	Safety	https://ryedesign.github.io/spare-parts-assets/Banner_85069_XS16SISafetyInput.png	https://ryedesign.github.io/spare-parts-assets/Banner_85069_XS16SISafetyInput.pdf		banner, banner engineering, safety
85073	XS4SO Safety PLC BANNER Safe Outputs Module	BANNER	Safety	https://ryedesign.github.io/spare-parts-assets/Banner_85073_XS4SOSafetyOutput.png	https://ryedesign.github.io/spare-parts-assets/Banner_85073_XS4SOSafetyOutput.pdf		banner, banner engineering, controller, plc, safety, safety controller, safety plc
IS3805MP-14621-SA	IN-SIGHT 3800 VISION SYSTEM WITH MULTI TORCH	COGNEX	Robotics Accessories	https://ryedesign.github.io/spare-parts-assets/Cognex_IS3805MP-14621-SA_In-Sight3800Multitorch.png	https://ryedesign.github.io/spare-parts-assets/Cognex_IS3805MP-14621-SA_In-Sight3800Multitorch.pdf		camera, cognex, image sensor, in-sight, mig torch, robotic torch, robotics accessories, torch, vision sensor, vision system, welding torch
22CTM05-03002AH00334H	DORNER CLEATED BELT END DRIVE CONVEYOR	DORNER	Robotics Accessories	https://ryedesign.github.io/spare-parts-assets/Dorner_22CTM05-03002AH00334H_CleatedBeltEndDriveConveyor.png	https://ryedesign.github.io/spare-parts-assets/Dorner_22CTM05-03002AH00334H_CleatedBeltEndDriveConveyor.pdf		dorner, robotics accessories
70276038	CIRCUIT BREAKER, 2 POLE, 6A	EATON	Electrical	https://ryedesign.github.io/spare-parts-assets/Eaton_70276038_CircuitBreaker.png	https://ryedesign.github.io/spare-parts-assets/Eaton_70276038_CircuitBreaker.pdf		breaker, circuit breaker, eaton, electrical, overcurrent protection
GSS G8M5 75	VAC EXTENSION	EMI	Vacuum	https://ryedesign.github.io/spare-parts-assets/EMI_GSS-G8M5-75_18inch75mmLM5.png	https://ryedesign.github.io/spare-parts-assets/EMI_GSS-G8M5-75_18inch75mmLM5.pdf		emi, vacuum
121202	FP24106, ECO LROEM 1.15 x 1, ROHS/GREEN Compliant	ENIDINE	Motion	https://ryedesign.github.io/spare-parts-assets/Enidine_121202_ShockAbsorber.png	https://ryedesign.github.io/spare-parts-assets/Enidine_121202_ShockAbsorber.pdf		enidine, motion
5801596	ECO OEM Small Bore Series Hydraulic Shock Absorber—Adjustable—Piston Rod Dia: 0.19 in	ENIDINE	Motion	https://ryedesign.github.io/spare-parts-assets/Enidine_5801596_ShockAbsorber.png	https://ryedesign.github.io/spare-parts-assets/Enidine_5801596_Shock Absorber.pdf		damper, energy absorber, enidine, motion, shock absorber
A05B-1220-J151	300-1500Kg Single Axis Follower Unit (Insulated flange)	FANUC	Robotics Accessories	https://ryedesign.github.io/spare-parts-assets/Fanuc_A05B-1220-J151_300-1500KgSingleAxisFollowerUnit.png	https://ryedesign.github.io/spare-parts-assets/Fanuc_A05B-1220-J151_300-1500KgSingleAxisFollowerUnit.pdf		fanuc, r-30ib, r30ib, robot controller, robotics accessories
BACH-37-150	BALL LOCK HANDLE	FIXTUREWORKS	Hardware	https://ryedesign.github.io/spare-parts-assets/Fixtureworks_BACH-37-150_BallLockHandle.png	https://ryedesign.github.io/spare-parts-assets/Fixtureworks_BACH-37-150_BallLockHandle.pdf		fixtureworks, hardware
THFR-375	BALL LOCK PIN RECEPTACLE	FIXTUREWORKS	Hardware	https://ryedesign.github.io/spare-parts-assets/Fixtureworks_THFR-375_BallLockPinReceptacle.png	https://ryedesign.github.io/spare-parts-assets/Fixtureworks_THFR-375_BallLockPinReceptacle.pdf		fixtureworks, hardware
09160243001	HAN INSERT	HARTING	Electrical	https://ryedesign.github.io/spare-parts-assets/Harting_09160243001_HanInsert.png	https://ryedesign.github.io/spare-parts-assets/Harting_09160243001_HanInsert.pdf		electrical, harting
09160243101	HAN INSERT	HARTING	Electrical	https://ryedesign.github.io/spare-parts-assets/Harting_09160243101_HanInsert.png	https://ryedesign.github.io/spare-parts-assets/Harting_09160243101_HanInsert.pdf		electrical, harting
09200100301	HAN BASE	HARTING	Electrical	https://ryedesign.github.io/spare-parts-assets/Harting_09200100301_HanBase.png	https://ryedesign.github.io/spare-parts-assets/Harting_09200100301_HanBase.pdf		electrical, harting
09200101541	Han Hood	HARTING	Electrical	https://ryedesign.github.io/spare-parts-assets/Harting_09200101541_HanHood.png	https://ryedesign.github.io/spare-parts-assets/Harting_09200101541_HanHood.pdf		electrical, harting
09200102612	Rectangular Plug Insert	HARTING	Electrical	https://ryedesign.github.io/spare-parts-assets/Harting_09200102612_RectangularPlugInsert.png	https://ryedesign.github.io/spare-parts-assets/Harting_09200102612_RectangularPlugInsert.pdf		electrical, harting
09200102812	Rectangular Socket Insert	HARTING	Electrical	https://ryedesign.github.io/spare-parts-assets/Harting_09200102812_RectangularSocketInsert.png	https://ryedesign.github.io/spare-parts-assets/Harting_09200102812_RectangularSocketInsert.pdf		electrical, harting
09200160301	HAN INSERT	HARTING	Electrical	https://ryedesign.github.io/spare-parts-assets/Harting_09200160301_HanInsert.png	https://ryedesign.github.io/spare-parts-assets/Harting_09200160301_HAN INSERT.pdf		electrical, harting
09200162612	HAN INSERT	HARTING	Electrical	https://ryedesign.github.io/spare-parts-assets/Harting_09200162612_HanInsert.png	https://ryedesign.github.io/spare-parts-assets/Harting_09200162612_HanInsert.pdf		electrical, harting
09300060302	HAN BASE	HARTING	Electrical	https://ryedesign.github.io/spare-parts-assets/Harting_09300060302_HanBase.png	https://ryedesign.github.io/spare-parts-assets/Harting_09300060302_HanBase.pdf		electrical, harting
09300061308	HAN BASE COVER	HARTING	Electrical	https://ryedesign.github.io/spare-parts-assets/Harting_09300061308_HanBaseCover.png	https://ryedesign.github.io/spare-parts-assets/Harting_09300061308_HanBaseCover.pdf		electrical, harting
09330062601	HAN INSERT	HARTING	Electrical	https://ryedesign.github.io/spare-parts-assets/Harting_09330062601_HanInsert.png	https://ryedesign.github.io/spare-parts-assets/Harting_09330062601_HanInsert.pdf		electrical, harting
19200100546	Side Metal Hood	HARTING	Electrical	https://ryedesign.github.io/spare-parts-assets/Harting_19200100546_HanSideMetalHood.png	https://ryedesign.github.io/spare-parts-assets/Harting_19200100546_HanSideMetalHood.pdf		electrical, harting
19200161540	Han Side Entry Connector Hood	HARTING	Electrical	https://ryedesign.github.io/spare-parts-assets/Harting_19200161540_HanSideEntryConnectorHood.png	https://ryedesign.github.io/spare-parts-assets/Harting_19200161540_HanSideEntryConnectorHood.pdf		electrical, harting
19300060546	Han Hood Side Entry 2 Pegs	HARTING	Electrical	https://ryedesign.github.io/spare-parts-assets/Harting_19300060546_HanHoodSideEntry2Pegs.png	https://ryedesign.github.io/spare-parts-assets/Harting_19300060546_HanHoodSideEntry2Pegs.pdf		electrical, harting
EC-RTC12M-330-0-PN	DC ROTARY	IAI	Motion	https://ryedesign.github.io/spare-parts-assets/IAI_EC-RTC12M-330-0-PN_DCRotary.png	https://ryedesign.github.io/spare-parts-assets/IAI_EC-RTC12M-330-0-PN_DCRotary.pdf		iai, motion
GC-1000	SAFETY PLC	KEYENCE	Safety	https://ryedesign.github.io/spare-parts-assets/Keyence_GC-1000_SafetyPLC.png	https://ryedesign.github.io/spare-parts-assets/Keyence_GC-1000_SafetyPLC.pdf		controller, keyence, plc, safety, safety controller, safety plc
GC-S16	SAFETY INPUTS	KEYENCE	Safety	https://ryedesign.github.io/spare-parts-assets/Keyence_GC-S16_SafetyInput.png	https://ryedesign.github.io/spare-parts-assets/Keyence_GC-S16_SafetyInput.pdf		keyence, safety
GC-S1R	SAFETY RELAY	KEYENCE	Safety	https://ryedesign.github.io/spare-parts-assets/Keyence_GC-S1R_SafetyRelay.png	https://ryedesign.github.io/spare-parts-assets/Keyence_GC-S1R_SafetyRelay.pdf		keyence, output relay, relay, safety, safety output, safety relay, switching
K2391-1	POWER REAM	LINCOLN	Robotics Accessories	https://ryedesign.github.io/spare-parts-assets/Lincoln_K2391-1_POWERREAM.png	https://ryedesign.github.io/spare-parts-assets/Lincoln_K2391-1_POWERREAM.pdf		lincoln, robotics accessories
K2685-3	AUTODRIVE	LINCOLN	Robotics Accessories	https://ryedesign.github.io/spare-parts-assets/Lincoln_K2685-3_AUTODRIVE.png	https://ryedesign.github.io/spare-parts-assets/Lincoln_K2685-3_AUTODRIVE.pdf		autodrive, lincoln, robotics accessories, wire drive, wire feeder
K3004-1	AUTODRIVE 19	LINCOLN	Robotics Accessories	https://ryedesign.github.io/spare-parts-assets/Lincoln_K3004-1_AUTODRIVE19.png	https://ryedesign.github.io/spare-parts-assets/Lincoln_K3004-1_AUTODRIVE19.pdf		autodrive, lincoln, robotics accessories, wire drive, wire feeder
K3279-1	POWER WAVE	LINCOLN	Robotics Accessories	https://ryedesign.github.io/spare-parts-assets/Lincoln_K3279-1_POWERWAVE.png	https://ryedesign.github.io/spare-parts-assets/Lincoln_K3279-1_POWERWAVE.pdf		lincoln, robotics accessories
K4713-1	COOLWAVE	LINCOLN	Robotics Accessories	https://ryedesign.github.io/spare-parts-assets/Lincoln_K4713-1_COOLWAVE.png	https://ryedesign.github.io/spare-parts-assets/Lincoln_K4713-1_COOLWAVE.pdf		cooling unit, lincoln, robotics accessories, torch cooler, water cooler
K5271-1	XTRACTOR SQUARED	LINCOLN	Robotics Accessories	https://ryedesign.github.io/spare-parts-assets/Lincoln_K5271-1_XTRACTORSQUARED.png	https://ryedesign.github.io/spare-parts-assets/Lincoln_K5271-1_XTRACTORSQUARED.pdf		fume extraction, fume gun, lincoln, robotics accessories, smoke extraction, weld fume
1497K979	Keyed Rotary Shaft	MCMASTER	Hardware	https://ryedesign.github.io/spare-parts-assets/McMaster_1497K979_KeyedRotaryShaft.png	https://ryedesign.github.io/spare-parts-assets/McMaster_1497K979_KeyedRotaryShaft.pdf		bearing, hardware, linear motion, mcmaster, mcmaster-carr, rail, shaft
47065T27	Diag Brace for 1.5x18inch Rail	MCMASTER	Hardware	https://ryedesign.github.io/spare-parts-assets/McMaster_47065T27_DiagBrace.png	https://ryedesign.github.io/spare-parts-assets/McMaster_47065T27_DiagBrace.pdf		bearing, hardware, linear motion, mcmaster, mcmaster-carr, rail, shaft
6508K131	Compact Rotary Air Actuator	MCMASTER	Actuator	https://ryedesign.github.io/spare-parts-assets/McMaster_6508K131_CompactRotaryAirActuator.png	https://ryedesign.github.io/spare-parts-assets/McMaster_6508K131_CompactRotaryAirActuator.pdf		actuator, hardware, mcmaster, mcmaster-carr
70978149	ATDR6 Fuse Time-Delay Class CC Current Limiting 200kA AC/100kA DC 600VAC/300VDC 6A	MERSEN	Electrical	https://ryedesign.github.io/spare-parts-assets/Mersen_70978149_ATDR6FuseTime-Delay.png	https://ryedesign.github.io/spare-parts-assets/Mersen_70978149_ATDR6FuseTime-Delay.pdf		electrical, fuse, mersen, overcurrent, protection
70978843	Fuseholder, Class CC, UltraSafe, 3P, 600VAC/DC, SCCR 200kA, 30A, Screw Terminal	MERSEN	Electrical	https://ryedesign.github.io/spare-parts-assets/Mersen_70978843_USCC3Fuseholder.png	https://ryedesign.github.io/spare-parts-assets/Mersen_70978843_USCC3Fuseholder.pdf		electrical, fuse, mersen, overcurrent, protection
A70QS50-22F	AMP TRAP FORM 101 Pn: 34987 UPC: 78200114210	MERSEN	Electrical	https://ryedesign.github.io/spare-parts-assets/Mersen_A70QS50-22F_AMP-TRAPSemiconductorFuse.png	https://ryedesign.github.io/spare-parts-assets/Mersen_A70QS50-22F_AMP-TRAPSemiconductorFuse.pdf		electrical, mersen
R331169 US223	ULTRASAFE 750V-100A 22MM 3P Pn: 10805 UPC: 78200131133	MERSEN	Electrical	https://ryedesign.github.io/spare-parts-assets/Mersen_R331169_US223UltraSafeModularFuseHolder.png	https://ryedesign.github.io/spare-parts-assets/Mersen_R331169_US223UltraSafeModularFuseHolder.pdf		electrical, mersen
58902	XENTERRA 8TX UNMANAGED SWITCH 8 PORT 100Mbit	MURR	Electrical	https://ryedesign.github.io/spare-parts-assets/Murr_58902_Xenterra8PortSwitch.png	https://ryedesign.github.io/spare-parts-assets/Murr_58902_Xenterra8PortSwitch.pdf		electrical, ethernet switch, murr, murr connector, murrelektronik, network switch, unmanaged switch
58904	XENTERRA 16TX UNMANAGED SWITCH 16 PORT 100Mbit	MURR	Electrical	https://ryedesign.github.io/spare-parts-assets/Murr_58904_Xenterra16PortSwitch.png	https://ryedesign.github.io/spare-parts-assets/Murr_58904_Xenterra16PortSwitch.pdf		electrical, ethernet switch, murr, murr connector, murrelektronik, network switch, unmanaged switch
8000-44752-0000000	5 PIN THRU WALL, SET OF 4	MURR	Electrical	https://ryedesign.github.io/spare-parts-assets/Murr_8000-44752-0000000_5PinThruWall.png	https://ryedesign.github.io/spare-parts-assets/Murr_8000-44752-0000000_5PinThruWall.pdf		electrical, murr, murr connector, murrelektronik
8000-88590-000000	EXACT12, 8XM12, 5 POL...5TH POLE CONNECTED (GROUND)..BACK SIDE TERMINALS	MURR	Electrical	https://ryedesign.github.io/spare-parts-assets/Murr_8000-88590-0000000_Exact12.png	https://ryedesign.github.io/spare-parts-assets/Murr_8000-88590-0000000_Exact12.pdf		electrical, murr, murr connector, murrelektronik
