ItemNumber	Description	Manufacturer	Category	ImageURL	PDFURL	ProductURL	Tags
OPTCT3MLSF	CT 3M Infrared Temperature Sensor	OPTRIS	Sensors	https://ryedesign.github.io/spare-parts-assets/Optris_OPTCT3MLSF_CT3MInfraredTempSensor.png	https://ryedesign.github.io/spare-parts-assets/Optris_OPTCT3MLSF_CT3MInfraredTempSensor.pdf		infrared, ir sensor, optris, sensors, temperature sensor, thermal sensor
CP10.241	POWER SUPPLY	PULS	Power	https://ryedesign.github.io/spare-parts-assets/PULS_CP10.241_PwrSply.png	https://ryedesign.github.io/spare-parts-assets/PULS_CP10.241_PwrSply.pdf		24v supply, dc power, power, power supply, psu, puls
CP20.241	POWER SUPPLY	PULS	Power	https://ryedesign.github.io/spare-parts-assets/PULS_CP20.241_PwrSply.png	https://ryedesign.github.io/spare-parts-assets/PULS_CP20.241_PwrSply.pdf		24v supply, dc power, power, power supply, psu, puls
CT10.241	POWER SUPPLY	PULS	Power	https://ryedesign.github.io/spare-parts-assets/PULS_CT10.241_PwrSply.png	https://ryedesign.github.io/spare-parts-assets/PULS_CT10.241_PwrSply.pdf		24v supply, dc power, power, power supply, psu, puls
QT20.241	POWER SUPPLY	PULS	Power	https://ryedesign.github.io/spare-parts-assets/PULS_QT20.241_PwrSply.png	https://ryedesign.github.io/spare-parts-assets/PULS_QT20.241_PwrSply.pdf		24v supply, dc power, power, power supply, psu, puls
108TX	ETHERNET SWITCH, RED LION, 8 PORT	RED LION	Electrical	https://ryedesign.github.io/spare-parts-assets/RedLion_108TX_EthernetSwitch.png	https://ryedesign.github.io/spare-parts-assets/RedLion_108TX_EthernetSwitch.pdf		cat5, electrical, ethernet, ethernet switch, m12 ethernet, network cable, network switch, red lion, rj45, unmanaged switch
CR1000-10000-00210	REDLION 10.4" HMI	RED LION	HMI	https://ryedesign.github.io/spare-parts-assets/RedLion_CR10001000000210_10inchHMI.jpg	https://ryedesign.github.io/spare-parts-assets/RedLion_CR10001000000210_10inchHMI.pdf		hmi, human machine interface, operator panel, red lion, touchscreen
CR3000-15000-00420	REDLION 15" HMI	RED LION	HMI	https://ryedesign.github.io/spare-parts-assets/RedLion_CR30001500000420_15inchHMI.png	https://ryedesign.github.io/spare-parts-assets/RedLion_CR30001500000420_15inchHMI.pdf		hmi, human machine interface, operator panel, red lion, touchscreen
1053014	MZT8-19VPS-KP0 Cylinder Sensor	SICK	Sensors	https://ryedesign.github.io/spare-parts-assets/Sick_1053014_MZT8-19VPS-KP0CylinderSensor.png	https://ryedesign.github.io/spare-parts-assets/Sick_1053014_MZT8-19VPS-KP0CylinderSensor.pdf		actuator, air cylinder, cylinder, cylinder sensor, magnetic sensor, piston sensor, pneumatic cylinder, position sensor, sensors, sick, sick safety, sick sensor
1058193	GRTE18S-P2347 GRTE SENSOR	SICK	Sensors	https://ryedesign.github.io/spare-parts-assets/Sick_1058193_GRTE18S-P2347Sensor.png	https://ryedesign.github.io/spare-parts-assets/Sick_1058193_GRTE18S-P2347Sensor.pdf		sensors, sick, sick safety, sick sensor
1072750	IMB12-08NPSVC0K HOMING SENSOR	SICK	Sensors	https://ryedesign.github.io/spare-parts-assets/Sick_1072750_IMB12-08NPSVC0KProximitySensor.png	https://ryedesign.github.io/spare-parts-assets/Sick_1072750_IMB12-08NPSVC0KProximitySensor.pdf		sensors, sick, sick safety, sick sensor
1073221	STR1-XAF SAFETY INTERLOCK MAGNET	SICK	Safety	https://ryedesign.github.io/spare-parts-assets/Sick_1073221_STR1-XAFSafetyInterlockMagnet.png	https://ryedesign.github.io/spare-parts-assets/Sick_1073221_STR1-XAFSafetyInterlockMagnet.pdf		door lock, interlock, safety, safety interlock, safety switch, sick, sick safety, sick sensor
1077942	MLP1-SMMC0AC DOOR LOCK	SICK	Safety	https://ryedesign.github.io/spare-parts-assets/Sick_1077942_MLP1-SMMC0ACMagneticLock.png	https://ryedesign.github.io/spare-parts-assets/Sick_1077942_MLP1-SMMC0ACMagneticLock.pdf		door lock, interlock, safety, safety interlock, safety switch, sick, sick safety, sick sensor
1083735	PAC50-FNA, PRESSURE SWITCH	SICK	Sensors	https://ryedesign.github.io/spare-parts-assets/Sick_1083735_PAC50-FNAPressureSensor.png	https://ryedesign.github.io/spare-parts-assets/Sick_1083735_PAC50-FNAPressureSensor.pdf		pressure sensor, pressure switch, pressure transducer, sensors, sick, sick safety, sick sensor
1083737	PAC50-FNC PRESSURE SENSOR	SICK	Sensors	https://ryedesign.github.io/spare-parts-assets/Sick_1083737_PAC50-FNCPressureSensor.png	https://ryedesign.github.io/spare-parts-assets/Sick_1083737_PAC50-FNCPressureSensor.pdf		pressure sensor, pressure switch, pressure transducer, sensors, sick, sick safety, sick sensor
1092921	HL18-P4A3AE PHOTOELECTRIC SENSOR	SICK	Sensors	https://ryedesign.github.io/spare-parts-assets/Sick_1092921_HL18-P4A3AEPhotoelectricSensor.png	https://ryedesign.github.io/spare-parts-assets/Sick_1092921_HL18-P4A3AEPhotoelectricSensor.pdf		beam sensor, optical sensor, photo eye, photoelectric, sensors, sick, sick safety, sick sensor
1105435	WTB4FT-22161120A00 SENSOR	SICK	Sensors	https://ryedesign.github.io/spare-parts-assets/Sick_1105435_WTB4FT-22161120A00W4Sensor.png	https://ryedesign.github.io/spare-parts-assets/Sick_1105435_WTB4FT-22161120A00W4Sensor.pdf		sensors, sick, sick safety, sick sensor
1117626	MLP1-SMUF0AC SAFETY LOCKING DEVICES	SICK	Safety	https://ryedesign.github.io/spare-parts-assets/Sick_1117626_MLP1-SMUF0ACSafetyLock.png	https://ryedesign.github.io/spare-parts-assets/Sick_1117626_MLP1-SMUF0ACSafetyLock.pdf		safety, sick, sick safety, sick sensor
1220131	C4P-SA15031A00 LIGHT CURTAIN, TRANSMITTER	SICK	Safety	https://ryedesign.github.io/spare-parts-assets/Sick_1220131_C4P-SA15031A00SafetyLightCurtainTransmitter.png	https://ryedesign.github.io/spare-parts-assets/Sick_1220131_C4P-SA15031A00SafetyLightCurtainTransmitter.pdf		light curtain, lightcurtain, presence detection, safety, safety curtain, sick, sick safety, sick sensor
1220158	C4P-EA15031D00 LIGHT CURTAIN, RECEIVER	SICK	Safety	https://ryedesign.github.io/spare-parts-assets/Sick_1220158_C4P-EA15031D00SafetyLightCurtainReceiver.png	https://ryedesign.github.io/spare-parts-assets/Sick_1220158_C4P-EA15031D00SafetyLightCurtainReceiver.pdf		light curtain, lightcurtain, presence detection, safety, safety curtain, sick, sick safety, sick sensor
2074242	MICS3 1B MOUNTING BRACKET	SICK	Hardware	https://ryedesign.github.io/spare-parts-assets/Sick_2074242_MICS3MOUNTINGBRACKET.avif	https://ryedesign.github.io/spare-parts-assets/Sick_2074242_MICS3MOUNTINGBRACKET.pdf		bracket, hardware, mounting, sick, sick safety, sick sensor
2076832	SP1-1000 LIGHT CURTAIN PLUG	SICK	Safety	https://ryedesign.github.io/spare-parts-assets/Sick_2076832_SP1-1000LightCurtainPlug.png	https://ryedesign.github.io/spare-parts-assets/Sick_2076832_SP1-1000LightCurtainPlug.pdf		light curtain, lightcurtain, presence detection, safety, safety curtain, sick, sick safety, sick sensor
2088111	LPC-WTT12L LENS PROTECTION COVER AND SCREENS	SICK	Safety	https://ryedesign.github.io/spare-parts-assets/Sick_2088111_LPC-WTT12LLensProtector.png	https://ryedesign.github.io/spare-parts-assets/Sick_2088111_LPC-WTT12LLensProtector.pdf		c-mount, lens, optics, safety, sick, sick safety, sick sensor
5314244	REF-IRF-56 REFLECTIVE TAPE	SICK	Safety	https://ryedesign.github.io/spare-parts-assets/Sick_5314244_REF-IRF-56ReflectiveTape.png	https://ryedesign.github.io/spare-parts-assets/Sick_5314244_REF-IRF-56ReflectiveTape.pdf		safety, sick, sick safety, sick sensor
6030664	DSC-1205T000025KM0 LIGHT CURTAIN TEE	SICK	Safety	https://ryedesign.github.io/spare-parts-assets/Sick_6030664_DSC-1205T000025KM0LightCurtainT.png	https://ryedesign.github.io/spare-parts-assets/Sick_6030664_DSC-1205T000025KM0LightCurtainT.pdf		light curtain, lightcurtain, presence detection, safety, safety curtain, sick, sick safety, sick sensor
1069565	STR1-SAFM0AC5 SAFETY SWITCH	SICK	Safety	https://ryedesign.github.io/spare-parts-assets/Sick_1069565_STR1-SAFM0AC5SafetySensor.png	https://ryedesign.github.io/spare-parts-assets/Sick_1069565_STR1-SAFM0AC5SafetySensor.pdf		door lock, interlock, safety, safety interlock, safety switch, sick, sick safety, sick sensor
1069566	STR1-SAFM0AC8 Sick non contact safety switch	SICK	Safety	https://ryedesign.github.io/spare-parts-assets/Sick_1069566_STR1-SAFM0AC8SafetySensor.avif	https://ryedesign.github.io/spare-parts-assets/Sick_1069566_STR1-SAFM0AC8SafetySensor.pdf		door lock, interlock, safety, safety interlock, safety switch, sick, sick safety, sick sensor
1075842	MICS3-AAAZ40AZ1P01 SENSOR, MICROSCAN 3, 4.4 M, CORE I/O	SICK	Sensors	https://ryedesign.github.io/spare-parts-assets/Sick_1075842_MICS3-AAAZ40AZ1P01SafetyLaserScanner.png	https://ryedesign.github.io/spare-parts-assets/Sick_1075842_MICS3-AAAZ40AZ1P01SafetyLaserScanner.pdf		sensors, sick, sick safety, sick sensor
1078201	MLP1-XXT DOOR LOCK TERMINATOR	SICK	Safety	https://ryedesign.github.io/spare-parts-assets/Sick_1078201_MLP1-XXTMLP1AdaptorEndPlug.png	https://ryedesign.github.io/spare-parts-assets/Sick_1078201_MLP1-XXTMLP1AdaptorEndPlug.pdf		door lock, interlock, safety, safety interlock, safety switch, sick, sick safety, sick sensor
1082473	WTT12L-A2543 MultiTask Photoelectric Sensors; Power Prox	SICK	Sensors	https://ryedesign.github.io/spare-parts-assets/Sick_1082473_WTT12L-A2543DistanceSensor.avif	https://ryedesign.github.io/spare-parts-assets/Sick_1082473_WTT12L-A2543DistanceSensor.pdf		beam sensor, optical sensor, photo eye, photoelectric, sensors, sick, sick safety, sick sensor
2066614	BEF-1SHABPKU4 Bracket	SICK	Hardware	https://ryedesign.github.io/spare-parts-assets/Sick_2066614_BEF-1SHABPKU4Bracket.png	https://ryedesign.github.io/spare-parts-assets/Sick_2066614_BEF-1SHABPKU4Bracket.pdf		bracket, hardware, mounting, sick, sick safety, sick sensor
2077683	BEF-KHZ-RT1-63: Accessories Mounting systems	SICK	Hardware	https://ryedesign.github.io/spare-parts-assets/Sick_2077683_BEF-KHZ-RT1-63MountingSystem.png	https://ryedesign.github.io/spare-parts-assets/Sick_2077683_BEF-KHZ-RT1-63MountingSystem.pdf		bracket, hardware, mounting, sick, sick safety, sick sensor
2092167	MLP1-XA ACTUATOR	SICK	Actuator	https://ryedesign.github.io/spare-parts-assets/Sick_2092167_MLP1-XAActuator.png	https://ryedesign.github.io/spare-parts-assets/Sick_2092167_MLP1-XAActuator.pdf		actuator, sick, sick safety, sick sensor
EX600-DMPE-DSUB	VAC CONTROL DIO	SMC	Vacuum	https://ryedesign.github.io/spare-parts-assets/SMC_EX600-DMPE-DSUB_VacControlDio.png	https://ryedesign.github.io/spare-parts-assets/SMC_EX600-DMPE-DSUB_VacControlDio.PDF		smc, vacuum
EX600-EU1	VAC CONTROL END PLATE	SMC	Vacuum	https://ryedesign.github.io/spare-parts-assets/SMC_EX600-EU1_VacControlEndPlate.png	https://ryedesign.github.io/spare-parts-assets/SMC_EX600-EU1_VacControlEndPlate.pdf		smc, vacuum
EX600-SEN7	VAC CONTROL EIP	SMC	Vacuum	https://ryedesign.github.io/spare-parts-assets/SMC_EX600-SEN7_VacControlEIP.png	https://ryedesign.github.io/spare-parts-assets/SMC_EX600-SEN7_VacControlEIP.PDF		smc, vacuum
M-5AU-6	BARBED NIPPLE	SMC	Vacuum	https://ryedesign.github.io/spare-parts-assets/SMC_M-5AU-6_BarbedNipple.png	https://ryedesign.github.io/spare-parts-assets/SMC_M-5AU-6_BarbedNipple.pdf		smc, vacuum
ZK2C15K5RWA-06	VAC PUMP	SMC	Vacuum	https://ryedesign.github.io/spare-parts-assets/SMC_ZK2C15K5RWA-06_VacPump.png	https://ryedesign.github.io/spare-parts-assets/SMC_ZK2C15K5RWA-06_VacPump.PDF		smc, vacuum
ZP08BS	VAC CUP	SMC	Vacuum	https://ryedesign.github.io/spare-parts-assets/SMC_ZP08BS_VacCup.png	https://ryedesign.github.io/spare-parts-assets/SMC_ZP08BS_VacCup.pdf		smc, vacuum
ZZK204A-A1F-BL-A	VAC STACK END PLATES	SMC	Vacuum	https://ryedesign.github.io/spare-parts-assets/SMC_ZZK204A-A1F-BL-A_VacStackEndPlates.png	https://ryedesign.github.io/spare-parts-assets/SMC_ZZK204A-A1F-BL-A_VacStackEndPlates.PDF		smc, vacuum
UCP213-40	UCP 200 Pillow Block Mounted Bearings - Set Screw Locking	TIMKEN	Hardware	https://ryedesign.github.io/spare-parts-assets/Timkin_UCP213-40_PillowBlockMountedBearings.png	https://ryedesign.github.io/spare-parts-assets/Timkin_UCP213-40_PillowBlockMountedBearings.pdf		bearing, bracket, hardware, linear motion, mounting, rail, shaft, timken
CC20 SK48.000	Double Acting Cable Cylinder Bore Size: 20	TOLOMATIC	Hardware	https://ryedesign.github.io/spare-parts-assets/Tolomatic_CC20-SK48.000_DoubleActingCableCylinder.png	https://ryedesign.github.io/spare-parts-assets/Tolomatic_CC20-SK48.000_DoubleActingCableCylinder.pdf		actuator, air cylinder, cylinder, hardware, pneumatic cylinder, tolomatic
6814023	TBEN-S1-8DXP COMPACT MULTIPROTOCOL I/O MODULE FOR ETHERNET	TURCK	Electrical	https://ryedesign.github.io/spare-parts-assets/Turck_6814023_TBEN-S1-8DXPEthernetModule.png	https://ryedesign.github.io/spare-parts-assets/Turck_6814023_TBEN-S1-8DXPEthernetModule.pdf		cat5, digital input, digital output, electrical, ethernet, i/o, io module, m12 ethernet, network cable, plc io, rj45, turck, turck cable, turck sensor
6814034	TBEN-S1-8DIP-D COMPACT MULTIPROTOCOL I/O MODULE FOR ETHERNET	TURCK	Electrical	https://ryedesign.github.io/spare-parts-assets/Turck_6814034_TBEN-S1-8DIP-DEthernetModule.png	https://ryedesign.github.io/spare-parts-assets/Turck_6814034_TBEN-S1-8DIP-DEthernetModule.pdf		cat5, digital input, digital output, electrical, ethernet, i/o, io module, m12 ethernet, network cable, plc io, rj45, turck, turck cable, turck sensor
100033118	EKRB001-ESRB001-A5.500-WE2Y-5 10M CABLE	TURCK	Cables	https://ryedesign.github.io/spare-parts-assets/Turck_100033118_EKRB001-ESRB001-A5.500-WE2Y-510MCable.png	https://ryedesign.github.io/spare-parts-assets/Turck_100033118_EKRB001-ESRB001-A5.500-WE2Y-510MCable.pdf		cables, turck, turck cable, turck sensor
100034179	EKRT-ESRT-A5.500-GC2K-15 Extension Cable (L) 15 m, M12, Fem, Straight, 5-pi TURCK	TURCK	Cables	https://ryedesign.github.io/spare-parts-assets/Turck_100034179_EKRT-ESRT-A5.500-GC2K-15FemaleM125Pin15MCord.png	https://ryedesign.github.io/spare-parts-assets/Turck_100034179_EKRT-ESRT-A5.500-GC2K-15FemaleM125Pin15MCord.pdf		cables, cordset, extension, m12 cable, sensor cable, turck, turck cable, turck sensor
100039954	EKRT-ESRT-A4.400-GC2K-15 Straight Male, Female M12, 4-pin, 15 m length	TURCK	Cables	https://ryedesign.github.io/spare-parts-assets/Turck_100039954_EKRT-ESRT-A4.400-GC2K-15M124Pin15MCord.png	https://ryedesign.github.io/spare-parts-assets/Turck_100039954_EKRT-ESRT-A4.400-GC2K-15M124Pin15MCord.pdf		cables, turck, turck cable, turck sensor
U0886-0	FS 4.4-2 Receptacle, Front Mt, Male M12 eurofast Receptacle	TURCK	Electrical	https://ryedesign.github.io/spare-parts-assets/Turck_U0886-0_FS4.4-2Connector.png	https://ryedesign.github.io/spare-parts-assets/Turck_U0886-0_FS4.4-2Connector.pdf		electrical, turck, turck cable, turck sensor
U1132-022	FK 8-2 M12 8 pin Female Bulkhead receptacle 2M of flying leads	TURCK	Electrical	https://ryedesign.github.io/spare-parts-assets/Turck_U1132-022_FK8-2M12Female8Pin.png	https://ryedesign.github.io/spare-parts-assets/Turck_U1132-022_FK8-2M12Female8Pin.pdf		electrical, turck, turck cable, turck sensor
U2503-14	PKG 4M-2 Cordset	TURCK	Cables	https://ryedesign.github.io/spare-parts-assets/Turck_U2503-14_PKG 4M-2Cordset.png	https://ryedesign.github.io/spare-parts-assets/Turck_U2503-14_PKG 4M-2Cordset.pdf		cables, cordset, extension, m12 cable, sensor cable, turck, turck cable, turck sensor
U3-00647	FKSDD RJ45SF 44 THRU WALL, TURCK, M12-4P-F TO RJ45, RT ANGLE	TURCK	Electrical	https://ryedesign.github.io/spare-parts-assets/Turck_U3-00647_FKSDD-RJ45SF-44ThruWall.png	https://ryedesign.github.io/spare-parts-assets/Turck_U3-00647_FKSDD-RJ45SF-44ThruWall.pdf		electrical, turck, turck cable, turck sensor
U9518-02	FK 4.4-2 M12 4 wire female receptacle with 2M of flying leads	TURCK	Electrical	https://ryedesign.github.io/spare-parts-assets/Turck_U9518-02_FK4.4-2M12Female4Pin.png	https://ryedesign.github.io/spare-parts-assets/Turck_U9518-02_FK4.4-2M12Female4Pin.pdf		electrical, turck, turck cable, turck sensor
1315680000	UR20-4AO-UI-16 WEIM ANALOG OUTPUT MODULE	WEIDMULLER	Electrical	https://ryedesign.github.io/spare-parts-assets/Weidmuller_1315680000_UR20-4AO-UI-16AnalogOutputModule.png	https://ryedesign.github.io/spare-parts-assets/Weidmuller_1315680000_UR20-4AO-UI-16AnalogOutputModule.pdf		electrical, remote io, ur20, weidmuller, weidmüller
1334710000	UR20-PF-I Weidmuller In Power Block	WEIDMULLER	Electrical	https://ryedesign.github.io/spare-parts-assets/Weidmuller_1334710000_UR20-PF-IRemoteIOModule.png	https://ryedesign.github.io/spare-parts-assets/Weidmuller_1334710000_UR20-PF-IRemoteIOModule.pdf		electrical, remote io, ur20, weidmuller, weidmüller
1334740000	UR20-PF-O Expandable IO, Power Output Module	WEIDMULLER	Electrical	https://ryedesign.github.io/spare-parts-assets/Weidmuller_1334740000_UR20-PF-OPowerOutputModule.png	https://ryedesign.github.io/spare-parts-assets/Weidmuller_1334740000_UR20-PF-OPowerOutputModule.pdf		electrical, remote io, ur20, weidmuller, weidmüller
1550550000	UR20-FBC-EIP-V2 Expandable IO, Ethernet IP Comms Module	WEIDMULLER	Electrical	https://ryedesign.github.io/spare-parts-assets/Weidmuller_1550550000_UR20-FBC-EIP-V2ExpandableIO.png	https://ryedesign.github.io/spare-parts-assets/Weidmuller_1550550000_UR20-FBC-EIP-V2ExpandableIO.pdf		cat5, electrical, ethernet, m12 ethernet, network cable, remote io, rj45, ur20, weidmuller, weidmüller
KLBUE4-13.5_SC	S7S S7W 400V SHIELD CLAMP UP 500W	YASKAWA	Servo	https://ryedesign.github.io/spare-parts-assets/Yaskawa_KLBUE4-13.5_ShieldClamp.png	https://ryedesign.github.io/spare-parts-assets/Yaskawa_KLBUE4-13.5_ShieldClamp.pdf		bracket, hardware, mounting, servo, sigma, yaskawa, yaskawa drive, yaskawa motor
SGD7S-120AM0A008F50	SERVO DRIVE	YASKAWA	Servo	https://ryedesign.github.io/spare-parts-assets/Yaskawa_SGD7S-120AM0A008F50_ServoDrive1.5KW200V1PH.png	https://ryedesign.github.io/spare-parts-assets/Yaskawa_SGD7S-120AM0A008F50_ServoDrive1.5KW200V1PH.pdf		amplifier, drive, servo, servo amplifier, servo drive, sigma, yaskawa, yaskawa drive, yaskawa motor
SGD7S-5R4DM0B000F50	SIGMA-7SIEC 1.5KW 400V (Servo Amplifier)	YASKAWA	Servo	https://ryedesign.github.io/spare-parts-assets/Yaskawa_SGD7S-5R4DM0B000F50_ServoAmplifier1.5KW400V.png	https://ryedesign.github.io/spare-parts-assets/Yaskawa_SGD7S-5R4DM0B000F50_ServoAmplifier1.5KW400V.pdf		amplifier, drive, servo, servo amplifier, servo drive, sigma, yaskawa, yaskawa drive, yaskawa motor
SGM7D-1CI7C52	SERVO ROTARY	YASKAWA	Servo	https://ryedesign.github.io/spare-parts-assets/Yaskawa_SGM7D-1CI7C52_ServoRotary.png	https://ryedesign.github.io/spare-parts-assets/Yaskawa_SGM7D-1CI7C52_ServoRotary.pdf		motor, rotary, servo, servo motor, servomotor, sigma, yaskawa, yaskawa drive, yaskawa motor
SGM7G-13D7FK1	S7 MTR 1.3KW 400V ABS KW TP (Servo Motor)	YASKAWA	Servo	https://ryedesign.github.io/spare-parts-assets/Yaskawa_SGM7G-13D7FK1_ServoMotor1.5kW.png	https://ryedesign.github.io/spare-parts-assets/Yaskawa_SGM7G-13D7FK1_ServoMotor1.5kW.pdf		motor, rotary, servo, servo motor, servomotor, sigma, yaskawa, yaskawa drive, yaskawa motor
SGM7G-44D6F6C	Servo Motor 4.4kW	YASKAWA	Servo	https://ryedesign.github.io/spare-parts-assets/Yaskawa_SGM7G-44D6F6C_ServoMotor4.4kW.jpg	https://ryedesign.github.io/spare-parts-assets/Yaskawa_SGM7G-44D6F6C_ServoMotor4.4kW.pdf		motor, rotary, servo, servo motor, servomotor, sigma, yaskawa, yaskawa drive, yaskawa motor
1072821	IMB18-08BPSVC0K-PROX-SENSOR	SICK	Sensors	https://ryedesign.github.io/spare-parts-assets/SICK_1072821_IMB18-08BPSVC0K-PROX-SENSOR.png	https://ryedesign.github.io/spare-parts-assets/SICK_1072821_IMB18-08BPSVC0K-PROX-SENSOR.pdf		sensors, sick, sick safety, sick sensor
AFSB-1002	Single arm basic kit	Swivellink	Robotics Accessories	https://ryedesign.github.io/spare-parts-assets/Swivellink_AFSB-1002_single-arm-basic-kit.png	https://ryedesign.github.io/spare-parts-assets/Swivellink_AFSB-1002_single-arm-basic-kit.pdf		robotics accessories, swivellink
U-55725	PSGS 4M RJ45S 4413-1M Ethernet Cordset Ex Cable	TURCK	Cables	https://ryedesign.github.io/spare-parts-assets/turck_u-55725_1m-extension-cable.png	https://ryedesign.github.io/spare-parts-assets/turck_u-55725_1m-extension-cable.pdf		cables, cat5, cordset, ethernet, extension, m12 cable, m12 ethernet, network cable, rj45, sensor cable, turck, turck cable, turck sensor
U-51193	RK 4.4T-12-RS 4.4T/S1587 Actuator and Sensor Cable 12m	TURCK	Cables	https://ryedesign.github.io/spare-parts-assets/turck_U-51193_12m-ex-cable.png	https://ryedesign.github.io/spare-parts-assets/turck_U-51193_12m-ex-cable.pdf		cables, cordset, extension, m12 cable, sensor cable, turck, turck cable, turck sensor
UX08873	RK 4.4T-4-RS 4.4T/S3415 Actuator and Sensor Cable 4m	TURCK	Cables	https://ryedesign.github.io/spare-parts-assets/turck_UX08873_ex-cable-4m.png	https://ryedesign.github.io/spare-parts-assets/turck_UX08873_ex-cable-4m.pdf		cables, cordset, extension, m12 cable, sensor cable, turck, turck cable, turck sensor
U99-11861	RKC 8T-10-RSC 8T Actuator and Sensor Cable 10m	TURCK	Cables	https://ryedesign.github.io/spare-parts-assets/turck_U99-11861_ex-cable-10m.png	https://ryedesign.github.io/spare-parts-assets/turck_U99-11861_ex-cable-10m.pdf		cables, cordset, extension, m12 cable, sensor cable, turck, turck cable, turck sensor
U99-11870	RKC 8T-4-RSC 8T Actuator and Sensor Cable 4m	TURCK	Cables	https://ryedesign.github.io/spare-parts-assets/turck_U99-11870_ex-cable-4m.png	https://ryedesign.github.io/spare-parts-assets/turck_U99-11870_ex-cable-4m.pdf		cables, cordset, extension, m12 cable, sensor cable, turck, turck cable, turck sensor
U-02484	RSSD RSSD 441-4M Extension Cable 4m	TURCK	Cables	https://ryedesign.github.io/spare-parts-assets/turck_u-02484_ex-cable-4m.png	https://ryedesign.github.io/spare-parts-assets/turck_u-02484_ex-cable-4m.pdf		cables, cordset, extension, m12 cable, sensor cable, turck, turck cable, turck sensor
U-06867	RSSD RSSD 441-5M Extension Cable 5m	TURCK	Cables	https://ryedesign.github.io/spare-parts-assets/turck_u-06867_ex-cable-5m.png	https://ryedesign.github.io/spare-parts-assets/turck_u-06867_ex-cable-5m.pdf		cables, cordset, extension, m12 cable, sensor cable, turck, turck cable, turck sensor
SCE-30N2408LP	Enclosure	Saginaw	Electrical	https://ryedesign.github.io/spare-parts-assets/saginaw_sce-30n2408lp_enclosure.png			cabinet, electrical, electrical enclosure, enclosure, panel, saginaw
SCE-30N24MP	Subpanel	Saginaw	Electrical	https://ryedesign.github.io/spare-parts-assets/saginaw_sce-30n24mp_back-panel-for-sce-30N2408LP.png			cabinet, electrical, electrical enclosure, enclosure, panel, saginaw
42115	High Speed Protective Shutter for 100L and 350L laser-cameras	Servo-Robot	Vision				servo-robot, vision
42117	Electrically insulated precision holder for laser-camera	Servo-Robot	Vision				servo-robot, vision
76855	System Interface Box 24VDC	Servo-Robot	Vision				servo-robot, vision
80160210	10m Industrial shielded ethernet cable (RJ45 to etherCON RJ45)	Servo-Robot	Cables				cables, cat5, ethernet, m12 ethernet, network cable, rj45, servo-robot
80340110	10m Universal Robot Sensor cable (M16 to M16, 12pos)	Servo-Robot	Cables				cables, cordset, extension, m12 cable, sensor cable, servo-robot
80340210	10m Extension Cable M16/12 female to M16/12 male	Servo-Robot	Cables				cables, cordset, extension, m12 cable, sensor cable, servo-robot
9899-0047	Calibration target 2.0	Servo-Robot	Vision				servo-robot, vision
AD1389-36	MONOFLEX ROBOT KIT,70MM BODY,19MM NECK	Lincoln	Robotics Accessories	https://ryedesign.github.io/spare-parts-assets/lincoln_AD1389-36_on-torch-kit.png			lincoln, robotics accessories
K5412-1	INLET PLUG KIT	Lincoln	Robotics Accessories				lincoln, robotics accessories
A4000580	GROUND PIN ASBLY. W/BKT, 900A (replaces L10402-4 -- obsolete/discontinued)	Lincoln	Robotics Accessories				lincoln, robotics accessories
1865K7	Aluminum Easy-Access Base-Mounted Shaft Support, Anodized, Low-Profile T-Shaped, For 1-1/4" Shaft Diameter	McMaster-Carr	Hardware	https://ryedesign.github.io/spare-parts-assets/mcmc_1865K7_t-shaped-shaft-support.png	https://ryedesign.github.io/spare-parts-assets/mcmc_1865K7_t-shaped-shaft-support.pdf		bearing, bracket, hardware, linear motion, mcmaster, mcmaster-carr, mounting, rail, shaft
7257K2	Hook-and-Loop Wrap-Around Sleeving Nylon Fabric, 1-1/2" ID, 25 ft. Length	McMaster-Carr	Electrical	https://ryedesign.github.io/spare-parts-assets/mcmc_7257K2_wire-sleeve-1.5in-ID-50ft.png			electrical, hardware, mcmaster, mcmaster-carr
8157K64	Cable SJT, Black Outer Insulation, 16 Gauge, 50 ft. Length	McMaster-Carr	Cables	https://ryedesign.github.io/spare-parts-assets/mcmc_8157K64_16g-cable-sjt-50ft.png			cables, hardware, mcmaster, mcmaster-carr
7940A97	Welding Cable 600V AC/DC, 3/0-Gauge Wire, Black Outer Insulation, 50 ft. Length	McMaster-Carr	Cables	https://ryedesign.github.io/spare-parts-assets/mcmc_7940A97_weld-cable-50ft.png			cables, hardware, mcmaster, mcmaster-carr
8031K28	Compression Butt Splice For 3/0 Wire Gauge	McMaster-Carr	Electrical	https://ryedesign.github.io/spare-parts-assets/mcmc_8031K28_comp-splice.png	https://ryedesign.github.io/spare-parts-assets/mcmc_8031K28_comp-splice.pdf		electrical, hardware, mcmaster, mcmaster-carr
4766T11	Washdown Relay, Spdt, 12V Ac/Dc, 24V Ac/Dc, 120V Ac	McMaster-Carr	Hardware	https://ryedesign.github.io/spare-parts-assets/mcmc_4766T11_washdown-relay.png			hardware, mcmaster, mcmaster-carr, output relay, relay, switching
1865K112	Aluminum Easy-Access Base-Mounted Shaft Support, Black Anodized, T-Shaped, For 1" Shaft Diameter	McMaster-Carr	Hardware	https://ryedesign.github.io/spare-parts-assets/mcm_1865K112_blk-t-shaped-shaft-support.png	https://ryedesign.github.io/spare-parts-assets/mcm_1865K112_blk-t-shaped-shaft-support.pdf		bearing, bracket, hardware, linear motion, mcmaster, mcmaster-carr, mounting, rail, shaft
